Name;URL;Author;Price;Number of ratings;Average Rating
Last Week Tonight with John Oliver Presents a Day in the Life of Marlon Bundo;https://www.amazon.com/Tonight-Oliver-Presents-Marlon-Bundo/dp/145217380X?_encoding=UTF8&psc=1;Jill Twiss;$12.25;4,875;4.9 out of 5 stars
12 Rules for Life: An Antidote to Chaos;https://www.amazon.com/12-Rules-Life-Antidote-Chaos/dp/0345816021?_encoding=UTF8&psc=1;Jordan B. Peterson;$15.75;1,705;4.7 out of 5 stars
Ready Player One: A Novel;https://www.amazon.com/Ready-Player-One-Ernest-Cline/dp/0307887448?_encoding=UTF8&psc=1;Ernest Cline;$8.79;16,544;4.6 out of 5 stars
The Subtle Art of Not Giving a F*ck: A Counterintuitive Approach to Living a Good Life;https://www.amazon.com/Subtle-Art-Not-Giving-Counterintuitive/dp/0062457713?_encoding=UTF8&psc=1;Mark Manson;$14.99;3,301;4.4 out of 5 stars
Dear Madam President: An Open Letter to the Women Who Will Run the World;https://www.amazon.com/Dear-Madam-President-Letter-Women/dp/1538713454?_encoding=UTF8&psc=1;Jennifer Palmieri;$12.01;21;4.6 out of 5 stars
The Don't Laugh Challenge - Easter Edition: Easter Edition - Don't Laugh Challenge: Easter Joke Book for Kids with Knock-Knock Jokes and Riddles Included;https://www.amazon.com/Dont-Laugh-Challenge-Knock-Knock-Included/dp/1945006803?_encoding=UTF8&psc=1;Don't Laugh Joke;$8.66;13;4.5 out of 5 stars
A Higher Loyalty: Truth, Lies, and Leadership;https://www.amazon.com/Higher-Loyalty-Truth-Lies-Leadership/dp/1250192455?_encoding=UTF8&psc=1;James Comey;$15.99;Not Available;Not Available
Magnolia Table: A Collection of Recipes for Gathering;https://www.amazon.com/Magnolia-Table-Collection-Recipes-Gathering/dp/006282015X?_encoding=UTF8&psc=1;Joanna Gaines;$16.19;Not Available;Not Available
I've Loved You Since Forever;https://www.amazon.com/Ive-Loved-You-Since-Forever/dp/0062841742?_encoding=UTF8&psc=1;Hoda Kotb;$14.24;81;4.5 out of 5 stars
A Wrinkle in Time (Time Quintet);https://www.amazon.com/Wrinkle-Time-Quintet/dp/0312367546?_encoding=UTF8&psc=1;Madeleine L'Engle;$4.93;2,993;4.5 out of 5 stars
You Are a Badass: How to Stop Doubting Your Greatness and Start Living an Awesome Life;https://www.amazon.com/You-Are-Badass-Doubting-Greatness/dp/0762447699?_encoding=UTF8&psc=1;Jen Sincero;$9.60;3,372;4.6 out of 5 stars
The 5 Love Languages: The Secret to Love that Lasts;https://www.amazon.com/Love-Languages-Secret-that-Lasts/dp/080241270X?_encoding=UTF8&psc=1;Gary Chapman;$9.59;12,695;4.8 out of 5 stars
The Berenstain Bears and the Easter Story: Stickers Included! (Berenstain Bears/Living Lights);https://www.amazon.com/Berenstain-Bears-Easter-Story-Stickers/dp/0310720877?_encoding=UTF8&psc=1;Mike Berenstain;$4.01;345;4.6 out of 5 stars
Easter Eggstravaganza Mad Libs;https://www.amazon.com/Easter-Eggstravaganza-Libs-Roger-Price/dp/0843172525?_encoding=UTF8&psc=1;Roger Price;$4.99;138;4.6 out of 5 stars
Llama Llama Easter Egg;https://www.amazon.com/Llama-Easter-Egg-Anna-Dewdney/dp/0451469828?_encoding=UTF8&psc=1;Anna Dewdney;$4.83;218;4.5 out of 5 stars
Girl, Wash Your Face: Stop Believing the Lies About Who You Are so You Can Become Who You Were Meant to Be;https://www.amazon.com/Girl-Wash-Your-Face-Believing/dp/1400201659?_encoding=UTF8&psc=1;Rachel Hollis;$13.79;1,157;4.9 out of 5 stars
Little Fires Everywhere;https://www.amazon.com/Little-Fires-Everywhere-Celeste-Ng/dp/0735224293?_encoding=UTF8&psc=1;Celeste Ng;$15.28;2,129;4.4 out of 5 stars
Tiger Woods;https://www.amazon.com/Tiger-Woods-Jeff-Benedict/dp/1501126423?_encoding=UTF8&psc=1;Jeff Benedict;$18.00;11;4.3 out of 5 stars
Secret Empires: How the American Political Class Hides Corruption and Enriches Family and Friends;https://www.amazon.com/Secret-Empires-American-Political-Corruption/dp/0062569368?_encoding=UTF8&psc=1;Peter Schweizer;$17.39;54;4.6 out of 5 stars
The Complete Ketogenic Diet for Beginners: Your Essential Guide to Living the Keto Lifestyle;https://www.amazon.com/Complete-Ketogenic-Diet-Beginners-Essential/dp/1623158087?_encoding=UTF8&psc=1;Amy Ramos;$6.95;698;4.2 out of 5 stars
First 100 Words;https://www.amazon.com/First-100-Words-Roger-Priddy/dp/0312510780?_encoding=UTF8&psc=1;Roger Priddy;$4.34;7,820;4.6 out of 5 stars
This Is Me: Loving the Person You Are Today;https://www.amazon.com/This-Me-Loving-Person-Today/dp/0062837877?_encoding=UTF8&psc=1;Chrissy Metz;$16.19;7;4.6 out of 5 stars
Monster Manual (D&D Core Rulebook);https://www.amazon.com/Monster-Manual-Core-Rulebook-Wizards/dp/0786965614?_encoding=UTF8&psc=1;Wizards RPG Team;$23.98;1,123;4.7 out of 5 stars
Russian Roulette: The Inside Story of Putin's War on America and the Election of Donald Trump;https://www.amazon.com/Russian-Roulette-Inside-America-Election/dp/1538728753?_encoding=UTF8&psc=1;Michael Isikoff;$18.00;197;4.7 out of 5 stars
Player's Handbook (Dungeons & Dragons);https://www.amazon.com/Players-Handbook-Dungeons-Dragons-Wizards/dp/0786965606?_encoding=UTF8&psc=1;Wizards RPG Team;$27.27;2,515;4.6 out of 5 stars
Milk and Honey;https://www.amazon.com/Milk-Honey-Rupi-Kaur/dp/144947425X?_encoding=UTF8&psc=1;Rupi Kaur;$8.99;5,379;4.6 out of 5 stars
Dog Man and Cat Kid: From the Creator of Captain Underpants (Dog Man #4);https://www.amazon.com/Dog-Man-Cat-Kid-Underpants/dp/0545935180?_encoding=UTF8&psc=1;Dav Pilkey;$6.40;362;4.9 out of 5 stars
Killing the Deep State: The Fight to Save President Trump;https://www.amazon.com/Killing-Deep-State-Fight-President/dp/1630061026?_encoding=UTF8&psc=1;Jerome R. Corsi;$17.99;366;4.7 out of 5 stars
Happy Easter, Mouse! (If You Give...);https://www.amazon.com/Happy-Easter-Mouse-You-Give/dp/0694014222?_encoding=UTF8&psc=1;Laura Numeroff;$5.63;283;4.5 out of 5 stars
The Four Agreements: A Practical Guide to Personal Freedom (A Toltec Wisdom Book);https://www.amazon.com/Four-Agreements-Practical-Personal-Freedom/dp/1878424319?_encoding=UTF8&psc=1;Don Miguel Ruiz;$7.77;6,894;4.6 out of 5 stars
Giraffes Can't Dance;https://www.amazon.com/Giraffes-Cant-Dance-Giles-Andreae/dp/0545392551?_encoding=UTF8&psc=1;Giles Andreae;$5.06;3,836;4.7 out of 5 stars
How to Win Friends & Influence People;https://www.amazon.com/How-Win-Friends-Influence-People/dp/0671027034?_encoding=UTF8&psc=1;Dale Carnegie;$9.60;8,030;4.7 out of 5 stars
The Very Hungry Caterpillar;https://www.amazon.com/Very-Hungry-Caterpillar-Eric-Carle/dp/0399226907?_encoding=UTF8&psc=1;Eric Carle;$6.61;3,415;4.6 out of 5 stars
Goodnight Moon;https://www.amazon.com/Goodnight-Moon-Margaret-Wise-Brown/dp/0694003611?_encoding=UTF8&psc=1;Margaret Wise Brown;$5.89;3,144;4.7 out of 5 stars
Children of Blood and Bone (Legacy of Orisha);https://www.amazon.com/Children-Blood-Bone-Legacy-Orisha/dp/1250170974?_encoding=UTF8&psc=1;Tomi Adeyemi;$11.56;243;4.8 out of 5 stars
Food: What the Heck Should I Eat?;https://www.amazon.com/Food-What-Heck-Should-Eat/dp/0316338869?_encoding=UTF8&psc=1;Mark Hyman M.D.;$16.80;197;4.6 out of 5 stars
Faith: A Journey For All;https://www.amazon.com/Faith-Journey-All-Jimmy-Carter/dp/1501184415?_encoding=UTF8&psc=1;Jimmy Carter;$18.18;1;5.0 out of 5 stars
Try Not to Laugh Challenge, Easter Joke Book for Kids: Easter Basket Stuffer for Boys, Girls, Teens & Adults, Fun Easter Activity Book with Cute ... Easter Activities for the Whole Family!;https://www.amazon.com/Laugh-Challenge-Easter-Joke-Book/dp/1986554902?_encoding=UTF8&psc=1;Easter Bunny Press;$6.77;Not Available;Not Available
Wonder;https://www.amazon.com/Wonder-R-J-Palacio/dp/0375869026?_encoding=UTF8&psc=1;R. J. Palacio;$10.19;12,628;4.9 out of 5 stars
The Whole30: The 30-Day Guide to Total Health and Food Freedom;https://www.amazon.com/Whole30-30-Day-Guide-Health-Freedom/dp/0544609719?_encoding=UTF8&psc=1;Melissa Hartwig;$18.00;3,201;4.6 out of 5 stars
Dear Zoo: A Lift-the-Flap Book;https://www.amazon.com/Dear-Zoo-Lift-Flap-Book/dp/141694737X?_encoding=UTF8&psc=1;Rod Campbell;$4.71;2,564;4.8 out of 5 stars
Little Blue Truck's Springtime;https://www.amazon.com/Little-Trucks-Springtime-Alice-Schertle/dp/0544938097?_encoding=UTF8&psc=1;Alice Schertle;$9.17;77;3.7 out of 5 stars
Before We Were Yours: A Novel;https://www.amazon.com/Before-We-Were-Yours-Novel/dp/0425284689?_encoding=UTF8&psc=1;Lisa Wingate;$15.60;5,961;4.7 out of 5 stars
The Sun and Her Flowers;https://www.amazon.com/Sun-Her-Flowers-Rupi-Kaur/dp/1449486797?_encoding=UTF8&psc=1;Rupi Kaur;$10.19;674;4.6 out of 5 stars
Ready Player One;https://www.amazon.com/Ready-Player-One-Ernest-Cline/dp/030788743X?_encoding=UTF8&psc=1;Ernest Cline;$10.42;16,544;4.6 out of 5 stars
The Wonderful Things You Will Be;https://www.amazon.com/Wonderful-Things-You-Will-Be/dp/0385376715?_encoding=UTF8&psc=1;Emily Winfield Martin;$12.19;1,447;4.8 out of 5 stars
It's Not Easy Being a Bunny (Beginner Books(R));https://www.amazon.com/Easy-Being-Bunny-Beginner-Books/dp/0394861027?_encoding=UTF8&psc=1;Marilyn Sadler;$6.79;230;4.8 out of 5 stars
Principles: Life and Work;https://www.amazon.com/Principles-Life-Work-Ray-Dalio/dp/1501124021?_encoding=UTF8&psc=1;Ray Dalio;$18.00;465;4.4 out of 5 stars
Pete the Cat: Big Easter Adventure;https://www.amazon.com/Pete-Cat-Big-Easter-Adventure/dp/006219867X?_encoding=UTF8&psc=1;James Dean;$7.08;217;4.6 out of 5 stars
Genius Foods: Become Smarter, Happier, and More Productive While Protecting Your Brain for Life;https://www.amazon.com/Genius-Foods-Smarter-Productive-Protecting/dp/0062562851?_encoding=UTF8&psc=1;Max Lugavere;$16.79;62;4.9 out of 5 stars
Simon vs. the Homo Sapiens Agenda;https://www.amazon.com/Simon-vs-Homo-Sapiens-Agenda/dp/006234868X?_encoding=UTF8&psc=1;Becky Albertalli;$6.69;824;4.7 out of 5 stars
The Great Alone: A Novel;https://www.amazon.com/Great-Alone-Novel-Kristin-Hannah/dp/0312577230?_encoding=UTF8&psc=1;Kristin Hannah;$17.39;1,647;4.6 out of 5 stars
"The Plant Paradox: The Hidden Dangers in ""Healthy"" Foods That Cause Disease and Weight Gain";https://www.amazon.com/Plant-Paradox-Dangers-Healthy-Disease/dp/006242713X?_encoding=UTF8&psc=1;Dr. Steven R Gundry;$16.79;1,262;4.5 out of 5 stars
On Tyranny: Twenty Lessons from the Twentieth Century;https://www.amazon.com/Tyranny-Twenty-Lessons-Twentieth-Century/dp/0804190119?_encoding=UTF8&psc=1;Timothy Snyder;$5.84;1,830;4.6 out of 5 stars
The Pout-Pout Fish;https://www.amazon.com/Pout-Pout-Fish-Deborah-Diesen/dp/0374360979?_encoding=UTF8&psc=1;Deborah Diesen;$5.79;2,287;4.8 out of 5 stars
Embraced: 100 Devotions to Know God Is Holding You Close;https://www.amazon.com/Embraced-Devotions-Know-Holding-Close/dp/1400310296?_encoding=UTF8&psc=1;Lysa TerKeurst;$12.39;8;4.7 out of 5 stars
World of Warcraft Chronicle Volume 3;https://www.amazon.com/World-Warcraft-Chronicle-BLIZZARD-ENTERTAINMENT/dp/1616558474?_encoding=UTF8&psc=1;BLIZZARD;$23.99;7;3.1 out of 5 stars
Dungeon Master's Guide (D&D Core Rulebook);https://www.amazon.com/Dungeon-Masters-Guide-Core-Rulebook/dp/0786965622?_encoding=UTF8&psc=1;Wizards RPG Team;$23.98;1,138;4.6 out of 5 stars
Astrophysics for People in a Hurry;https://www.amazon.com/Astrophysics-People-Hurry-deGrasse-Tyson/dp/0393609391?_encoding=UTF8&psc=1;Neil deGrasse Tyson;$11.37;2,606;4.6 out of 5 stars
God Gave Us Easter;https://www.amazon.com/Gave-Easter-Lisa-Tawn-Bergren/dp/0307730727?_encoding=UTF8&psc=1;Lisa Tawn Bergren;$7.59;258;4.6 out of 5 stars
StrengthsFinder 2.0;https://www.amazon.com/StrengthsFinder-2-0-Tom-Rath/dp/159562015X?_encoding=UTF8&psc=1;Tom Rath;$17.79;3,425;4.0 out of 5 stars
The Great Easter Race! (Sesame Street Scribbles);https://www.amazon.com/Great-Easter-Sesame-Street-Scribbles/dp/1492638374?_encoding=UTF8&psc=1;Sesame Workshop;$6.98;10;5.0 out of 5 stars
What to Expect When You're Expecting;https://www.amazon.com/What-Expect-When-Youre-Expecting/dp/0761187480?_encoding=UTF8&psc=1;Heidi Murkoff;$14.36;4,050;4.4 out of 5 stars
Beneath a Scarlet Sky: A Novel;https://www.amazon.com/Beneath-Scarlet-Sky-Mark-Sullivan/dp/1503943372?_encoding=UTF8&psc=1;Mark Sullivan;$8.63;17,119;4.8 out of 5 stars
The 7 Habits of Highly Effective People: Powerful Lessons in Personal Change;https://www.amazon.com/Habits-Highly-Effective-People-Powerful/dp/1451639619?_encoding=UTF8&psc=1;Stephen R. Covey;$10.25;4,962;4.5 out of 5 stars
The Alchemist;https://www.amazon.com/Alchemist-Paulo-Coelho/dp/0062315005?_encoding=UTF8&psc=1;Paulo Coelho;$10.19;11,748;4.6 out of 5 stars
Everything Happens for a Reason: And Other Lies I've Loved;https://www.amazon.com/Everything-Happens-Reason-Other-Loved/dp/0399592067?_encoding=UTF8&psc=1;Kate Bowler;$18.20;168;4.6 out of 5 stars
Bright Baby Touch and Feel Easter;https://www.amazon.com/Bright-Baby-Touch-Feel-Easter/dp/0312513755?_encoding=UTF8&psc=1;Roger Priddy;$3.80;172;3.5 out of 5 stars
Baby Touch and Feel: Animals;https://www.amazon.com/Baby-Touch-Feel-Animals-DK/dp/0756634687?_encoding=UTF8&psc=1;DK;$4.19;1,626;4.5 out of 5 stars
The Keto Diet: The Complete Guide to a High-Fat Diet, with More Than 125 Delectable Recipes and 5 Meal Plans to Shed Weight, Heal Your Body, and Regain Confidence;https://www.amazon.com/Keto-Diet-Complete-Delectable-Confidence/dp/1628600160?_encoding=UTF8&psc=1;Leanne Vogel;$25.63;1,456;4.6 out of 5 stars
The Instant Pot Electric Pressure Cooker Cookbook: Easy Recipes for Fast & Healthy Meals;https://www.amazon.com/Instant-Electric-Pressure-Cooker-Cookbook/dp/1623156122?_encoding=UTF8&psc=1;Laurel Randolph;$7.19;2,243;4.1 out of 5 stars
Brown Bear, Brown Bear, What Do You See?;https://www.amazon.com/Brown-Bear-What-You-See/dp/0805047905?_encoding=UTF8&psc=1;Bill Martin Jr.;$6.08;2,670;4.8 out of 5 stars
Unfu*k Yourself: Get Out of Your Head and into Your Life;https://www.amazon.com/Unfu-Yourself-Your-Head-into/dp/0062803832?_encoding=UTF8&psc=1;Gary John Bishop;$11.54;533;4.5 out of 5 stars
Lettering and Modern Calligraphy: A Beginner's Guide: Learn Hand Lettering and Brush Lettering;https://www.amazon.com/Lettering-Modern-Calligraphy-Beginners-Guide/dp/1948209004?_encoding=UTF8&psc=1;Paper Peony Press;$6.99;173;4.5 out of 5 stars
Love You Forever;https://www.amazon.com/Love-You-Forever-Robert-Munsch/dp/0920668372?_encoding=UTF8&psc=1;Robert Munsch;$5.08;6,344;4.8 out of 5 stars
Big Preschool Workbook;https://www.amazon.com/Preschool-Workbook-School-Zone-Staff/dp/0887431453?_encoding=UTF8&psc=1;School Zone Staff;$7.49;709;4.7 out of 5 stars
Potty (Leslie Patricelli board books);https://www.amazon.com/Potty-Leslie-Patricelli-board-books/dp/0763644765?_encoding=UTF8&psc=1;Leslie Patricelli;$4.00;2,976;4.6 out of 5 stars
Educated: A Memoir;https://www.amazon.com/Educated-Memoir-Tara-Westover/dp/0399590501?_encoding=UTF8&psc=1;Tara Westover;$16.80;497;4.7 out of 5 stars
The List: A Week-by-Week Reckoning of Trumpâ€™s First Year;https://www.amazon.com/List-Week-Week-Reckoning-Trumps/dp/1635572711?_encoding=UTF8&psc=1;Amy Siskind;$22.79;73;5.0 out of 5 stars
Marlon Bundo's Day in the Life of the Vice President;https://www.amazon.com/Marlon-Bundos-Life-Vice-President/dp/1621577767?_encoding=UTF8&psc=1;Charlotte Pence;$11.39;344;4.6 out of 5 stars
I'll Be Gone in the Dark: One Woman's Obsessive Search for the Golden State Killer;https://www.amazon.com/Ill-Be-Gone-Dark-Obsessive/dp/0062319787?_encoding=UTF8&psc=1;Michelle McNamara;$16.79;190;4.6 out of 5 stars
Jesus Calling: Enjoying Peace in His Presence;https://www.amazon.com/Jesus-Calling-Enjoying-Peace-Presence/dp/1591451884?_encoding=UTF8&psc=1;Sarah Young;$9.72;16,576;4.9 out of 5 stars
The Body Keeps the Score: Brain, Mind, and Body in the Healing of Trauma;https://www.amazon.com/Body-Keeps-Score-Healing-Trauma/dp/0143127748?_encoding=UTF8&psc=1;Bessel van der Kolk;$12.23;1,496;4.8 out of 5 stars
My First Easter;https://www.amazon.com/My-First-Easter-Tomie-dePaola/dp/0448447908?_encoding=UTF8&psc=1;Tomie dePaola;$5.24;84;4.1 out of 5 stars
The Official SAT Study Guide, 2018 Edition (Official Study Guide for the New Sat);https://www.amazon.com/Official-SAT-Study-Guide-2018/dp/1457309289?_encoding=UTF8&psc=1;The College Board;$19.79;221;4.5 out of 5 stars
The Gifts of Imperfection: Let Go of Who You Think You're Supposed to Be and Embrace Who You Are;https://www.amazon.com/Gifts-Imperfection-Think-Supposed-Embrace/dp/159285849X?_encoding=UTF8&psc=1;Brené Brown;$8.99;3,711;4.6 out of 5 stars
The Death and Life of the Great Lakes;https://www.amazon.com/Death-Life-Great-Lakes/dp/0393246434?_encoding=UTF8&psc=1;Dan Egan;$17.60;136;4.8 out of 5 stars
The Care and Keeping of You: The Body Book for Younger Girls, Revised Edition;https://www.amazon.com/Care-Keeping-You-Younger-Revised/dp/1609580834?_encoding=UTF8&psc=1;Valorie Schaefer;$8.89;2,462;4.8 out of 5 stars
A Brief History of Time;https://www.amazon.com/Brief-History-Time-Stephen-Hawking/dp/0553380168?_encoding=UTF8&psc=1;Stephen Hawking;$10.69;2,107;4.5 out of 5 stars
Am I There Yet?: The Loop-de-loop, Zigzagging Journey to Adulthood;https://www.amazon.com/There-Yet-Loop-loop-Zigzagging/dp/1524761435?_encoding=UTF8&psc=1;Mari Andrew;$12.81;19;5.0 out of 5 stars
10-Day Green Smoothie Cleanse;https://www.amazon.com/10-Day-Green-Smoothie-Cleanse-Smith/dp/1501100106?_encoding=UTF8&psc=1;JJ Smith;$9.59;8,700;4.7 out of 5 stars
The Total Money Makeover: Classic Edition: A Proven Plan for Financial Fitness;https://www.amazon.com/Total-Money-Makeover-Classic-Financial/dp/1595555277?_encoding=UTF8&psc=1;Dave Ramsey;$14.49;5,725;4.7 out of 5 stars
The Life-Changing Magic of Tidying Up: The Japanese Art of Decluttering and Organizing;https://www.amazon.com/Life-Changing-Magic-Tidying-Decluttering-Organizing/dp/1607747308?_encoding=UTF8&psc=1;Marie Kondō;$10.19;12,931;4.4 out of 5 stars
Man's Search for Meaning;https://www.amazon.com/Mans-Search-Meaning-Viktor-Frankl/dp/080701429X?_encoding=UTF8&psc=1;Viktor E. Frankl;$6.99;4,101;4.7 out of 5 stars
The Rational Bible: Exodus;https://www.amazon.com/Rational-Bible-Exodus-Dennis-Prager/dp/1621577724?_encoding=UTF8&psc=1;Dennis Prager;$31.40;Not Available;Not Available
I've Been Thinking . . .: Reflections, Prayers, and Meditations for a Meaningful Life;https://www.amazon.com/Ive-Been-Thinking-Reflections-Meditations/dp/0525522603?_encoding=UTF8&psc=1;Maria Shriver;$12.00;181;4.9 out of 5 stars
Discrimination and Disparities;https://www.amazon.com/Discrimination-Disparities-Thomas-Sowell/dp/154164560X?_encoding=UTF8&psc=1;Thomas Sowell;$16.80;10;4.3 out of 5 stars
The Untethered Soul: The Journey Beyond Yourself;https://www.amazon.com/Untethered-Soul-Journey-Beyond-Yourself/dp/1572245379?_encoding=UTF8&psc=1;Michael A. Singer;$12.00;4,370;4.7 out of 5 stars
A Gentleman in Moscow: A Novel;https://www.amazon.com/Gentleman-Moscow-Novel-Amor-Towles/dp/0670026190?_encoding=UTF8&psc=1;Amor Towles;$16.20;7,758;4.7 out of 5 stars
Medical Medium Thyroid Healing: The Truth behind Hashimoto's, Graves', Insomnia, Hypothyroidism, Thyroid Nodules & Epstein-Barr;https://www.amazon.com/Medical-Medium-Thyroid-Healing-Hypothyroidism/dp/1401948367?_encoding=UTF8&psc=1;Anthony William;$16.31;1,191;4.8 out of 5 stars
